US Style Number,US Season,Board Number,Item Description,US Model Description,GCC Style Description,HTS Description 1,HTS Description 2,HTS Description 3,AX Sub Class,US Brand,US Sub Brand,US Class
7352024LTBR,F12,O26SC10,LEATHER BARRACUDA-POLYESTER,LEATHER BARRACUDA,Men's Jacket,100% Real Lambskin Men's Jacket,TESTHTS2,TESTHTS3,Suede/Leather Outerwear,Menswear,POLO SPORTSWEAR,OUTERWEAR
3221691177NY,S13,,SS BIG PP POLO SHIRT-MESH,SS BIG PP POLO SHIRT,Boys Knit Shirt,100% COTTON Boys Knit Shirt,,,SS Big Pony Mesh,Childrenswear,BOYS 4-7,KNITS
322169117JAL,S13,,SS BIG PP POLO SHIRT-MESH,SS BIG PP POLO SHIRT,Boys Knit Shirt,100% COTTON Boys Knit Shirt,,,SS Big Pony Mesh,Childrenswear,BOYS 4-7,KNITS
443590,S13,K21RB05,SS SLD JRSY CN PK,SS SLD JRSY CN PK,Men's Knit T-Shirt,100% COTTON Men's Knit T-Shirt,,,,Menswear,MENS RRL,KNITS
4371543380AX,NOS,,DOUBLE HANDLE ATTACHE-ALLIGATOR,DOUBLE HANDLE ATTACHE,Handbag,100% Crocodile Handbag,,,Business Case,Leathergoods,MEN'S COLLECTION BAGS,EXOTIC BAGS
